id,title,category,location,date,gap_score,public_interest,why_missing,impact,source
1,"Severe Groundwater Contamination in Bundelkhand Villages","Environment","Bundelkhand, Uttar Pradesh","2026-05-10",85,"High","Lacks sensational visual appeal; remote rural region gets ignored by national mainstream media.","Over 50 villages face chronic health issues, including fluorosis and kidney ailments.","Local NGO Report / Ground Reality Census"
2,"Decay of Traditional Handloom Sectors in Telangana","Economy","Pochampally, Telangana","2026-04-18",75,"Medium","Overshadowed by tech sector and urban growth narratives in national financial news.","Thousands of weaver families face debt trap and migration due to lack of minimum support price.","Handloom Weavers Association Survey"
3,"Lack of Basic Infrastructure in Border Schools of Ladakh","Education","Changthang, Ladakh","2026-06-02",90,"High","National defense and geopolitical security news dominates, ignoring local developmental deficits.","Children walk up to 10km daily in sub-zero temperatures; high dropout rates in border districts.","Ladakh Students Welfare Association"
4,"Pesticide Health Crisis in Vidarbha Cotton Belt","Health","Vidarbha, Maharashtra","2026-03-29",80,"High","Mainstream coverage focuses only on general farmer debt, ignoring the specific chemical poisoning crisis.","Hospitalizations of farmers due to inhalation of toxic pesticides without safety gear.","Vidarbha Rural Health Survey"
5,"Threat to Sundarbans Honey Gatherers from Climate Migration","Climate Change","Sundarbans, West Bengal","2026-05-25",78,"Medium","Focus on short-term political battles in state capitals rather than long-term environmental displacement.","Traditional Mouli communities losing livelihoods, leading to rising man-animal conflict.","West Bengal Forest Department / Climate Action India"
