id,department,question,date,finding,related_story,source
1,"Ministry of Road Transport and Highways","What percentage of funds allocated for highway pothole repairs in the monsoon of 2024 was actually utilized?","2026-04-10","Only 35% of the allocated Rs 1,200 crore pothole repair fund was utilized, leaving Rs 780 crore unspent despite severe highway damage.","High rate of monsoon accidents on national highways due to unrepaired potholes.","MoRTH RTI Response - Ref No. 49302/2024"
2,"Municipal Corporation of Greater Mumbai (MCGM)","How many safety inspections were conducted on commercial complexes in Bandra West during 2023-2024?","2026-05-02","Out of 420 commercial structures, only 45 received mandatory fire safety audits, indicating a massive inspection backlog.","Commercial building fire incidents and compliance gaps.","MCGM Fire Department RTI Appeal-II"
3,"Central Pollution Control Board (CPCB)","What is the operational status of real-time air quality monitoring stations in tier-2 cities of North India?","2026-03-18","40% of the installed real-time monitoring stations in 15 major tier-2 cities were offline or malfunctioning for over 180 days in 2024.","Lack of accurate air pollution data in rising urban centers.","CPCB Air Quality Div RTI Reply"
4,"Food Safety and Standards Authority of India (FSSAI)","How many packaged food samples failed safety standards tests in 2023 and what action was taken?","2026-05-15","Out of 15,000 samples tested, 12% failed safety standards (mostly containing lead and unregistered additives); legal action was initiated in only 2% of cases.","Lack of enforcement on hazardous packaged foods.","FSSAI Lab Standards division RTI 2024"
5,"Department of School Education and Literacy","What is the status of functional girls' toilets in government schools in rural Bihar under Swachh Vidyalaya Scheme?","2026-06-01","55% of schools surveyed in rural districts have toilets, but only 22% are functional with running water, impacting female student attendance.","Sanitation crisis in rural education and impact on girls' dropout rates.","Ministry of Education School Sanitation Report RTI"
